{
  "$schema": "https://json-schema.org/draft/2020-12/schema",
  "type": "object",
  "additionalProperties": false,
  "required": [
    "artifact_version",
    "task_id",
    "task_title",
    "plan_status",
    "current_step_id",
    "replan_required",
    "halted",
    "failure_state",
    "execution",
    "updated_at"
  ],
  "properties": {
    "artifact_version": {
      "const": "1"
    },
    "task_id": {
      "type": "string",
      "pattern": ".*\\S.*"
    },
    "task_title": {
      "type": "string",
      "pattern": ".*\\S.*"
    },
    "plan_status": {
      "enum": [
        "approved",
        "complete"
      ]
    },
    "current_step_id": {
      "type": "integer"
    },
    "replan_required": {
      "type": "boolean"
    },
    "halted": {
      "type": "boolean"
    },
    "failure_state": {
      "type": "object",
      "additionalProperties": false,
      "required": [
        "last_failed_step",
        "failure_count"
      ],
      "properties": {
        "last_failed_step": {
          "type": "integer"
        },
        "failure_count": {
          "type": "integer"
        }
      }
    },
    "execution": {
      "type": "object",
      "additionalProperties": false,
      "required": [
        "step_attempt",
        "last_step_started_at",
        "last_step_completed_at"
      ],
      "properties": {
        "step_attempt": {
          "type": "integer"
        },
        "last_step_started_at": {
          "type": "string",
          "pattern": "^\\d{4}-\\d{2}-\\d{2}T\\d{2}:\\d{2}:\\d{2}Z$"
        },
        "last_step_completed_at": {
          "type": "string",
          "pattern": "^\\d{4}-\\d{2}-\\d{2}T\\d{2}:\\d{2}:\\d{2}Z$"
        }
      }
    },
    "updated_at": {
      "type": "string",
      "pattern": "^\\d{4}-\\d{2}-\\d{2}T\\d{2}:\\d{2}:\\d{2}Z$"
    }
  }
}
