{
  "artifact_version": "1",
  "task_id": "kozo-fixed-rust-user-execution",
  "task_title": "KOZO First Bounded Rust Userspace Execution",
  "plan_status": "approved",
  "current_step_id": 103,
  "replan_required": false,
  "halted": false,
  "failure_state": {
    "last_failed_step": 0,
    "failure_count": 0
  },
  "execution": {
    "step_attempt": 1,
    "last_step_started_at": "2026-10-15T20:17:07Z",
    "last_step_completed_at": "2026-10-15T19:18:00Z"
  },
  "updated_at": "2026-10-15T20:17:07Z"
}
